c0.source	c0.geneId	c0.source.1	c0.geneId.1	c0.source.2	c0.geneId.2	c0.associationType	c0.originalSource	c0.originalSource.1	c0.originalSource.2	c0.sentence	c0.pmid	c1.pantherName	c1.symbol	c1.geneId	c1.description	c1.symbol.1	c1.geneId.1	c2.diseaseId	c2.name	c2.hpoName	c2.diseaseId.1	c2.name.1	c2.STY	c2.MESH	c2.diseaseClassName	c2.doName	c2.type	c2.OMIM	c2.type.1	c3.score	c4.year
ALL	115	ALL	115	ALL	115	GeneticVariation	BEFREE	BEFREE	BEFREE	It identifies two X-linked genes associated with altered risk of severe malaria in females, identifies mutations in <span class= gene  id= 23144702-11-116-121 >ADCY9</span>, IL1A and CD40L as being associated with altered risk of severe respiratory distress and acidosis, both of which are characterised by high serum lactate levels, and also identifies novel genetic associations with severe malaria (TRIM5) and <span class= disease  id= 23144702-11-362-378 >cerebral malaria</span>(IL-13 and RTN3).	23144702	lyase	ADCY9	115	adenylate cyclase 9	ADCY9	115	C0024534	Malaria, Cerebral	null	C0024534	Malaria, Cerebral	Disease or Syndrome	D016779	Nervous System Diseases ; Parasitic Diseases	disease by infectious agent	disease	null	disease	0.0002747267842131	2012
ALL	183	ALL	183	ALL	183	GeneticVariation	BEFREE	BEFREE	BEFREE	Gene polymorphisms in angiotensin I converting enzyme (ACE I/D) and <span class= gene  id= 20117248-0-68-82 >angiotensin II</span> converting enzyme (ACE2 C--&gt;T) protect against <span class= disease  id= 20117248-0-130-146 >cerebral malaria</span> in Indian adults.	20117248	enzyme modulator	AGT	183	angiotensinogen	AGT	183	C0024534	Malaria, Cerebral	null	C0024534	Malaria, Cerebral	Disease or Syndrome	D016779	Nervous System Diseases ; Parasitic Diseases	disease by infectious agent	disease	null	disease	0.0002747267842131	2010
ALL	1984	ALL	1984	ALL	1984	AlteredExpression	BEFREE	BEFREE	BEFREE	CNI-1493 prevented infected mice from experimental <span class= disease  id= 22694849-3-51-67 >cerebral malaria</span> by decreasing the levels in hypusinated <span class= gene  id= 22694849-3-108-114 >eIF-5A</span> and serum TNF, implicating a link between cytokine signaling and the hypusine pathway.Therefore we addressed the question whether either DHS itself or eIF-5A is required for the outcome of severe malaria.	22694849	nucleic acid binding	EIF5A	1984	eukaryotic translation initiation factor 5A	EIF5A	1984	C0024534	Malaria, Cerebral	null	C0024534	Malaria, Cerebral	Disease or Syndrome	D016779	Nervous System Diseases ; Parasitic Diseases	disease by infectious agent	disease	null	disease	0.0002747267842131	2012
ALL	2015	ALL	2015	ALL	2015	GeneticVariation	BEFREE	BEFREE	BEFREE	MAS with coma/<span class= disease  id= 23614351-11-14-30 >cerebral malaria</span> were strongly associated with <span class= gene  id= 23614351-11-61-65 >EMR1</span>-<span class= variant  dbSNP= rs373533  genes_norm= 132014-1950-2015-2539-27190-3586-50604 >rs373533</span> in Kumasi (p = 0.00019) and IL10-<span class= variant  dbSNP= rs3024500  genes_norm= 132014-1950-2015-2539-27190-3586-50604 >rs3024500</span> in the pooled analysis across the sites (p = 0.00064).	23614351	defense/immunity protein; receptor	ADGRE1	2015	adhesion G protein-coupled receptor E1	ADGRE1	2015	C0024534	Malaria, Cerebral	null	C0024534	Malaria, Cerebral	Disease or Syndrome	D016779	Nervous System Diseases ; Parasitic Diseases	disease by infectious agent	disease	null	disease	0.0002747267842131	2013
ALL	2056	ALL	2056	ALL	2056	Biomarker	BEFREE	BEFREE	BEFREE	Recombinant human <span class= gene  id= 18179698-0-18-32 >erythropoietin</span> increases survival and reduces neuronal apoptosis in a murine model of <span class= disease  id= 18179698-0-104-120 >cerebral malaria</span>.	18179698	signaling molecule	EPO	2056	erythropoietin	EPO	2056	C0024534	Malaria, Cerebral	null	C0024534	Malaria, Cerebral	Disease or Syndrome	D016779	Nervous System Diseases ; Parasitic Diseases	disease by infectious agent	disease	null	disease	0.0002747267842131	2008
ALL	2213	ALL	2213	ALL	2213	AlteredExpression	BEFREE	BEFREE	BEFREE	Mice that are prone to SLE because of a deficiency in <span class= gene  id= 21187399-4-54-61 >Fc&gamma;RIIB</span> or overexpression of Toll-like receptor 7 are protected from death caused by <span class= disease  id= 21187399-4-139-155 >cerebral malaria</span>.	21187399	cell adhesion molecule	FCGR2B	2213	Fc fragment of IgG receptor IIb	FCGR2B	2213	C0024534	Malaria, Cerebral	null	C0024534	Malaria, Cerebral	Disease or Syndrome	D016779	Nervous System Diseases ; Parasitic Diseases	disease by infectious agent	disease	null	disease	0.0002747267842131	2011
ALL	23632	ALL	23632	ALL	23632	GeneticVariation	BEFREE	BEFREE	BEFREE	The IFNG-183G/T and IFNG(<span class= gene  id= 16088835-10-25-30 >CA)14</span>/(<span class= gene  id= 16088835-10-32-37 >CA)14</span> genotypes were more frequent in children with UM than in children with <span class= disease  id= 16088835-10-109-111 >CM</span> (odds ratio, 0.30 and 0.34, respectively).	16088835	lyase	CA14	23632	carbonic anhydrase 14	CA14	23632	C0024534	Malaria, Cerebral	null	C0024534	Malaria, Cerebral	Disease or Syndrome	D016779	Nervous System Diseases ; Parasitic Diseases	disease by infectious agent	disease	null	disease	0.0002747267842131	2005
ALL	23765	ALL	23765	ALL	23765	GeneticVariation	BEFREE	BEFREE	BEFREE	The IL17F and <span class= gene  id= 26667835-0-14-20 >IL17RA</span> Genetic Variants Increase Risk of <span class= disease  id= 26667835-0-55-71 >Cerebral Malaria</span> in Two African Populations.	26667835	null	IL17RA	23765	interleukin 17 receptor A	IL17RA	23765	C0024534	Malaria, Cerebral	null	C0024534	Malaria, Cerebral	Disease or Syndrome	D016779	Nervous System Diseases ; Parasitic Diseases	disease by infectious agent	disease	null	disease	0.0002747267842131	2015
ALL	25928	ALL	25928	ALL	25928	GeneticVariation	BEFREE	BEFREE	BEFREE	However, pair <span class= gene  id= 26462624-8-14-18 >wise</span> LD analysis revealed significant linkage between <span class= variant  dbSNP= NA  genes_norm= NA >T-1237C</span> and <span class= variant  dbSNP= NA  genes_norm= NA >T-1486C</span>, whereas haplotype analysis showed significantly low frequency of C-T haplotype in <span class= disease  id= 26462624-8-171-173 >CM</span> (p=0.005, pc=0.02) and high frequency of T-C haplotype in NCSM as compared to mild malaria.	26462624	null	SOSTDC1	25928	sclerostin domain containing 1	SOSTDC1	25928	C0024534	Malaria, Cerebral	null	C0024534	Malaria, Cerebral	Disease or Syndrome	D016779	Nervous System Diseases ; Parasitic Diseases	disease by infectious agent	disease	null	disease	0.0002747267842131	2015
ALL	283420	ALL	283420	ALL	283420	Biomarker	BEFREE	BEFREE	BEFREE	Cutting edge: <span class= gene  id= 22732587-0-14-20 >Clec9A</span>+ dendritic cells mediate the development of experimental <span class= disease  id= 22732587-0-78-94 >cerebral malaria</span>.	22732587	signaling molecule	CLEC9A	283420	C-type lectin domain family 9 member A	CLEC9A	283420	C0024534	Malaria, Cerebral	null	C0024534	Malaria, Cerebral	Disease or Syndrome	D016779	Nervous System Diseases ; Parasitic Diseases	disease by infectious agent	disease	null	disease	0.0002747267842131	2012
ALL	285	ALL	285	ALL	285	Biomarker	BEFREE	BEFREE	BEFREE	Whether by its antiplasmodial activity and/or by some unknown mechanisms, <span class= gene  id= 20117248-4-74-80 >Ang II</span> protects from susceptibility to <span class= disease  id= 20117248-4-113-129 >cerebral malaria</span> remains to be investigated.	20117248	signaling molecule	ANGPT2	285	angiopoietin 2	ANGPT2	285	C0024534	Malaria, Cerebral	null	C0024534	Malaria, Cerebral	Disease or Syndrome	D016779	Nervous System Diseases ; Parasitic Diseases	disease by infectious agent	disease	null	disease	0.0002747267842131	2010
ALL	29110	ALL	29110	ALL	29110	Biomarker	BEFREE	BEFREE	BEFREE	Mice lacking IRF3, IRF7, the kinase <span class= gene  id= 21820332-5-36-40 >TBK1</span> or the type I IFN receptor were resistant to otherwise lethal <span class= disease  id= 21820332-5-103-119 >cerebral malaria</span>.	21820332	transferase; kinase	TBK1	29110	TANK binding kinase 1	TBK1	29110	C0024534	Malaria, Cerebral	null	C0024534	Malaria, Cerebral	Disease or Syndrome	D016779	Nervous System Diseases ; Parasitic Diseases	disease by infectious agent	disease	null	disease	0.0002747267842131	2011
ALL	324	ALL	324	ALL	324	Biomarker	BEFREE	BEFREE	BEFREE	Cutting edge: conventional dendritic cells are the critical <span class= gene  id= 17475826-0-60-63 >APC</span> required for the induction of experimental <span class= disease  id= 17475826-0-107-123 >cerebral malaria</span>.	17475826	null	APC	324	APC, WNT signaling pathway regulator	APC	324	C0024534	Malaria, Cerebral	null	C0024534	Malaria, Cerebral	Disease or Syndrome	D016779	Nervous System Diseases ; Parasitic Diseases	disease by infectious agent	disease	null	disease	0.0002747267842131	2007
ALL	3347	ALL	3347	ALL	3347	GeneticVariation	BEFREE	BEFREE	BEFREE	In a study of 185 Black Tanzanian subjects, there were <span class= negexp >no significant differences in</span> <span class= gene  id= 9222761-11-85-89 >HIS2</span>(2) allelic frequencies between the various test groups: for 86 <span class= disease  id= 9222761-11-153-169 >cerebral malaria</span> subjects, 54 uncomplicated malaria subjects, and 45 combined asymptomatic parasitemia and health controls, HIS2(2) frequencies were 0.16, 0.17 and 0.17 respectively.	9222761	null	HTN3	3347	histatin 3	HTN3	3347	C0024534	Malaria, Cerebral	null	C0024534	Malaria, Cerebral	Disease or Syndrome	D016779	Nervous System Diseases ; Parasitic Diseases	disease by infectious agent	disease	null	disease	0.0002747267842131	1997
ALL	3456	ALL	3456	ALL	3456	GeneticVariation	BEFREE	BEFREE	BEFREE	A rare non-synonymous c.102C&gt;G SNP in the <span class= gene  id= 23333334-0-42-47 >IFNB1</span> gene might be a risk factor for <span class= disease  id= 23333334-0-80-96 >cerebral malaria</span> in Indian populations.	23333334	signaling molecule	IFNB1	3456	interferon beta 1	IFNB1	3456	C0024534	Malaria, Cerebral	null	C0024534	Malaria, Cerebral	Disease or Syndrome	D016779	Nervous System Diseases ; Parasitic Diseases	disease by infectious agent	disease	null	disease	0.0002747267842131	2012
ALL	3552	ALL	3552	ALL	3552	GeneticVariation	BEFREE	BEFREE	BEFREE	It identifies two X-linked genes associated with altered risk of severe malaria in females, identifies mutations in ADCY9, <span class= gene  id= 23144702-11-123-127 >IL1A</span> and CD40L as being associated with altered risk of severe respiratory distress and acidosis, both of which are characterised by high serum lactate levels, and also identifies novel genetic associations with severe malaria (TRIM5) and <span class= disease  id= 23144702-11-362-378 >cerebral malaria</span>(IL-13 and RTN3).	23144702	signaling molecule	IL1A	3552	interleukin 1 alpha	IL1A	3552	C0024534	Malaria, Cerebral	null	C0024534	Malaria, Cerebral	Disease or Syndrome	D016779	Nervous System Diseases ; Parasitic Diseases	disease by infectious agent	disease	null	disease	0.0002747267842131	2012
ALL	3557	ALL	3557	ALL	3557	GeneticVariation	BEFREE	BEFREE	BEFREE	The present results suggest that IL1B -31C&gt;T and <span class= gene  id= 16098232-6-49-54 >IL1RA</span> VNTR polymorphisms do <span class= negexp >not play a crucial role</span> in susceptibility or resistance to <span class= disease  id= 16098232-6-136-152 >cerebral malaria</span>.	16098232	signaling molecule	IL1RN	3557	interleukin 1 receptor antagonist	IL1RN	3557	C0024534	Malaria, Cerebral	null	C0024534	Malaria, Cerebral	Disease or Syndrome	D016779	Nervous System Diseases ; Parasitic Diseases	disease by infectious agent	disease	null	disease	0.0002747267842131	2005
ALL	3569	ALL	3569	ALL	3569	GeneticVariation	BEFREE	BEFREE	BEFREE	IFN-gamma and <span class= gene  id= 12232842-5-14-18 >IL-6</span> genotypes may play roles in the development of severe malaria and could contribute to the relative frequency of severe malarial anemia or <span class= disease  id= 12232842-5-157-173 >cerebral malaria</span> in exposed populations.	12232842	signaling molecule	IL6	3569	interleukin 6	IL6	3569	C0024534	Malaria, Cerebral	null	C0024534	Malaria, Cerebral	Disease or Syndrome	D016779	Nervous System Diseases ; Parasitic Diseases	disease by infectious agent	disease	null	disease	0.0002747267842131	2002
ALL	3596	ALL	3596	ALL	3596	GeneticVariation	BEFREE	BEFREE	BEFREE	It identifies two X-linked genes associated with altered risk of severe malaria in females, identifies mutations in ADCY9, IL1A and CD40L as being associated with altered risk of severe respiratory distress and acidosis, both of which are characterised by high serum lactate levels, and also identifies novel genetic associations with severe malaria (TRIM5) and <span class= disease  id= 23144702-11-362-378 >cerebral malaria</span>(<span class= gene  id= 23144702-11-379-384 >IL-13</span> and RTN3).	23144702	signaling molecule	IL13	3596	interleukin 13	IL13	3596	C0024534	Malaria, Cerebral	null	C0024534	Malaria, Cerebral	Disease or Syndrome	D016779	Nervous System Diseases ; Parasitic Diseases	disease by infectious agent	disease	null	disease	0.0002747267842131	2012
ALL	3605	ALL	3605	ALL	3605	Biomarker	BEFREE	BEFREE	BEFREE	To evaluate the involvement of <span class= gene  id= 26667835-3-31-36 >IL-17</span> cytokines in <span class= disease  id= 26667835-3-50-52 >CM</span>, we analyzed 46 common polymorphisms in IL17A, IL17F, and IL17RA (which encodes the common receptor chain of the members of the IL-17 family) in two independent African populations.	26667835	signaling molecule	IL17A	3605	interleukin 17A	IL17A	3605	C0024534	Malaria, Cerebral	null	C0024534	Malaria, Cerebral	Disease or Syndrome	D016779	Nervous System Diseases ; Parasitic Diseases	disease by infectious agent	disease	null	disease	0.0002747267842131	2015
ALL	361	ALL	361	ALL	361	Biomarker	BEFREE	BEFREE	BEFREE	Protective role of brain water channel <span class= gene  id= 23277579-0-39-43 >AQP4</span> in murine <span class= disease  id= 23277579-0-54-70 >cerebral malaria</span>.	23277579	transporter	AQP4	361	aquaporin 4	AQP4	361	C0024534	Malaria, Cerebral	null	C0024534	Malaria, Cerebral	Disease or Syndrome	D016779	Nervous System Diseases ; Parasitic Diseases	disease by infectious agent	disease	null	disease	0.0002747267842131	2013
ALL	3804	ALL	3804	ALL	3804	GeneticVariation	BEFREE	BEFREE	BEFREE	Significant association of <span class= gene  id= 22412373-0-27-34 >KIR2DL3</span>-HLA-C1 combination with <span class= disease  id= 22412373-0-59-75 >cerebral malaria</span> and implications for co-evolution of KIR and HLA.	22412373	defense/immunity protein; signaling molecule; receptor	KIR2DL3	3804	killer cell immunoglobulin like receptor, two Ig domains and long cytoplasmic tail 3	KIR2DL3	3804	C0024534	Malaria, Cerebral	null	C0024534	Malaria, Cerebral	Disease or Syndrome	D016779	Nervous System Diseases ; Parasitic Diseases	disease by infectious agent	disease	null	disease	0.0002747267842131	2012
ALL	3957	ALL	3957	ALL	3957	GeneticVariation	BEFREE	BEFREE	BEFREE	In a separate group of Tanzanian children originating from a malaria-endemic region, we found preservation of the major ancestral <span class= gene  id= 20500087-7-130-136 >LGALS2</span> allele and <span class= negexp >no association</span> with susceptibility to <span class= disease  id= 20500087-7-186-188 >CM</span>.	20500087	cell adhesion molecule; signaling molecule	LGALS2	3957	galectin 2	LGALS2	3957	C0024534	Malaria, Cerebral	null	C0024534	Malaria, Cerebral	Disease or Syndrome	D016779	Nervous System Diseases ; Parasitic Diseases	disease by infectious agent	disease	null	disease	0.0002747267842131	2010
ALL	4153	ALL	4153	ALL	4153	GeneticVariation	BEFREE	BEFREE	BEFREE	No difference in <span class= gene  id= 12933871-3-17-20 >MBL</span> genotype frequency was observed between infected and noninfected children or between children with <span class= disease  id= 12933871-3-120-136 >cerebral malaria</span> and/or severe malarial anemia and children with uncomplicated malaria.	12933871	defense/immunity protein	MBL2	4153	mannose binding lectin 2	MBL2	4153	C0024534	Malaria, Cerebral	null	C0024534	Malaria, Cerebral	Disease or Syndrome	D016779	Nervous System Diseases ; Parasitic Diseases	disease by infectious agent	disease	null	disease	0.0002747267842131	2003
ALL	4280	ALL	4280	ALL	4280	GeneticVariation	BEFREE	BEFREE	BEFREE	<span class= gene  id= 19000912-3-0-4 >Mice</span> genetically deficient in IDO-1 were <span class= negexp >not protected against</span> <span class= disease  id= 19000912-3-63-65 >CM</span>, but partial protection was observed in C57BL/6 mice treated with Ro 61-8048, an inhibitor of kynurenine-3-hydroxylase.	19000912	null	MICE	4280	MHC class I polypeptide-related sequence E (pseudogene)	MICE	4280	C0024534	Malaria, Cerebral	null	C0024534	Malaria, Cerebral	Disease or Syndrome	D016779	Nervous System Diseases ; Parasitic Diseases	disease by infectious agent	disease	null	disease	0.0002747267842131	2008
ALL	4842	ALL	4842	ALL	4842	GeneticVariation	BEFREE	BEFREE	BEFREE	Genetic variation in neuronal nitric oxide synthase (<span class= gene  id= 19540363-0-53-57 >nNOS</span>) gene and susceptibility to <span class= disease  id= 19540363-0-86-102 >cerebral malaria</span> in Indian adults.	19540363	null	NOS1	4842	nitric oxide synthase 1	NOS1	4842	C0024534	Malaria, Cerebral	null	C0024534	Malaria, Cerebral	Disease or Syndrome	D016779	Nervous System Diseases ; Parasitic Diseases	disease by infectious agent	disease	null	disease	0.0002747267842131	2009
ALL	51284	ALL	51284	ALL	51284	AlteredExpression	BEFREE	BEFREE	BEFREE	Mice that are prone to SLE because of a deficiency in Fc&gamma;RIIB or overexpression of <span class= gene  id= 21187399-4-83-103 >Toll-like receptor 7</span> are protected from death caused by <span class= disease  id= 21187399-4-139-155 >cerebral malaria</span>.	21187399	extracellular matrix protein; receptor	TLR7	51284	toll like receptor 7	TLR7	51284	C0024534	Malaria, Cerebral	null	C0024534	Malaria, Cerebral	Disease or Syndrome	D016779	Nervous System Diseases ; Parasitic Diseases	disease by infectious agent	disease	null	disease	0.0002747267842131	2011
ALL	51477	ALL	51477	ALL	51477	GeneticVariation	BEFREE	BEFREE	BEFREE	We examined associations of plasma NO metabolites (NOx) with symptoms of severe malaria, particularly malarial anaemia and <span class= disease  id= 15960706-4-123-139 >cerebral malaria</span>, and with <span class= gene  id= 15960706-4-150-154 >iNOS</span> promoter variants.	15960706	null	ISYNA1	51477	inositol-3-phosphate synthase 1	ISYNA1	51477	C0024534	Malaria, Cerebral	null	C0024534	Malaria, Cerebral	Disease or Syndrome	D016779	Nervous System Diseases ; Parasitic Diseases	disease by infectious agent	disease	null	disease	0.0002747267842131	2005
ALL	5196	ALL	5196	ALL	5196	Biomarker	BEFREE	BEFREE	BEFREE	<span class= gene  id= 18692777-0-0-17 >Platelet factor 4</span> mediates inflammation in experimental <span class= disease  id= 18692777-0-56-72 >cerebral malaria</span>.	18692777	signaling molecule	PF4	5196	platelet factor 4	PF4	5196	C0024534	Malaria, Cerebral	null	C0024534	Malaria, Cerebral	Disease or Syndrome	D016779	Nervous System Diseases ; Parasitic Diseases	disease by infectious agent	disease	null	disease	0.0002747267842131	2008
ALL	5451	ALL	5451	ALL	5451	GeneticVariation	BEFREE	BEFREE	BEFREE	The <span class= gene  id= 10369255-3-4-9 >OCT-1</span>-binding genotype, found in approximately 5% of Africans, is associated with fourfold increased susceptibility to <span class= disease  id= 10369255-3-123-139 >cerebral malaria</span> in large case-control studies of West African and East African populations, after correction for other known TNF polymorphisms and linked HLA alleles.	10369255	null	POU2F1	5451	POU class 2 homeobox 1	POU2F1	5451	C0024534	Malaria, Cerebral	null	C0024534	Malaria, Cerebral	Disease or Syndrome	D016779	Nervous System Diseases ; Parasitic Diseases	disease by infectious agent	disease	null	disease	0.0002747267842131	1999
ALL	5554	ALL	5554	ALL	5554	AlteredExpression	BEFREE	BEFREE	BEFREE	We found that DC8 CIDR&alpha;1 domains from severe malaria isolates had substantial differences in EPCR binding affinity and blockade activity for its ligand activated protein C. Additionally, even a low level of inhibition exhibited by domains from two <span class= disease  id= 27185931-5-248-264 >cerebral malaria</span> isolates was sufficient to interfere with activated <span class= gene  id= 27185931-5-317-326 >protein C</span>-barrier protective activities in human brain endothelial cells.	27185931	null	PRH1	5554	proline rich protein HaeIII subfamily 1	PRH1	5554	C0024534	Malaria, Cerebral	null	C0024534	Malaria, Cerebral	Disease or Syndrome	D016779	Nervous System Diseases ; Parasitic Diseases	disease by infectious agent	disease	null	disease	0.0002747267842131	2017
ALL	5555	ALL	5555	ALL	5555	AlteredExpression	BEFREE	BEFREE	BEFREE	We found that DC8 CIDR&alpha;1 domains from severe malaria isolates had substantial differences in EPCR binding affinity and blockade activity for its ligand activated protein C. Additionally, even a low level of inhibition exhibited by domains from two <span class= disease  id= 27185931-5-248-264 >cerebral malaria</span> isolates was sufficient to interfere with activated <span class= gene  id= 27185931-5-317-326 >protein C</span>-barrier protective activities in human brain endothelial cells.	27185931	null	PRH2	5555	proline rich protein HaeIII subfamily 2	PRH2	5555	C0024534	Malaria, Cerebral	null	C0024534	Malaria, Cerebral	Disease or Syndrome	D016779	Nervous System Diseases ; Parasitic Diseases	disease by infectious agent	disease	null	disease	0.0002747267842131	2017
ALL	56244	ALL	56244	ALL	56244	Biomarker	BEFREE	BEFREE	BEFREE	The T-Cell Inhibitory Molecule <span class= gene  id= 25883389-0-31-50 >Butyrophilin-Like 2</span> Is Up-regulated in Mild Plasmodium falciparum Infection and Is Protective During Experimental <span class= disease  id= 25883389-0-145-161 >Cerebral Malaria</span>.	25883389	null	BTNL2	56244	butyrophilin like 2	BTNL2	56244	C0024534	Malaria, Cerebral	null	C0024534	Malaria, Cerebral	Disease or Syndrome	D016779	Nervous System Diseases ; Parasitic Diseases	disease by infectious agent	disease	null	disease	0.0002747267842131	2015
ALL	56942	ALL	56942	ALL	56942	Biomarker	BEFREE	BEFREE	BEFREE	Cytoadherence phenotypes of IEs to CD36, ICAM-1, CSPG and the transcription patterns of A, B, var2csa, var3, var gene groups and domain cassettes DC8 and <span class= gene  id= 25156105-4-154-158 >DC13</span> were assessed in parasites from children with <span class= disease  id= 25156105-4-205-207 >CM</span> and uncomplicated malaria (UM) to determine if cytoadherence is related to a specific transcription profile of pfemp-1 variants.	25156105	null	CMC2	56942	C-X9-C motif containing 2	CMC2	56942	C0024534	Malaria, Cerebral	null	C0024534	Malaria, Cerebral	Disease or Syndrome	D016779	Nervous System Diseases ; Parasitic Diseases	disease by infectious agent	disease	null	disease	0.0002747267842131	2014
ALL	6037	ALL	6037	ALL	6037	GeneticVariation	BEFREE	BEFREE	BEFREE	Polymorphisms in the <span class= gene  id= 22216286-0-21-27 >RNASE3</span> gene are associated with susceptibility to <span class= disease  id= 22216286-0-71-87 >cerebral malaria</span> in Ghanaian children.	22216286	enzyme modulator; nucleic acid binding; hydrolase	RNASE3	6037	ribonuclease A family member 3	RNASE3	6037	C0024534	Malaria, Cerebral	null	C0024534	Malaria, Cerebral	Disease or Syndrome	D016779	Nervous System Diseases ; Parasitic Diseases	disease by infectious agent	disease	null	disease	0.0002747267842131	2011
ALL	6521	ALL	6521	ALL	6521	GeneticVariation	BEFREE	BEFREE	BEFREE	Whereas previous studies showed significant associations between Southeast Asian ovalocytosis (caused by a 27- base pair deletion in the <span class= gene  id= 11719395-3-137-154 >anion exchanger 1</span> protein gene) and protection from <span class= disease  id= 11719395-3-189-205 >cerebral malaria</span>, this mutation was observed in only 1 of 1019 individuals in the Wosera.	11719395	transporter	SLC4A1	6521	solute carrier family 4 member 1 (Diego blood group)	SLC4A1	6521	C0024534	Malaria, Cerebral	null	C0024534	Malaria, Cerebral	Disease or Syndrome	D016779	Nervous System Diseases ; Parasitic Diseases	disease by infectious agent	disease	null	disease	0.0002747267842131	2001
ALL	6580	ALL	6580	ALL	6580	GeneticVariation	BEFREE	BEFREE	BEFREE	The <span class= gene  id= 10369255-3-4-9 >OCT-1</span>-binding genotype, found in approximately 5% of Africans, is associated with fourfold increased susceptibility to <span class= disease  id= 10369255-3-123-139 >cerebral malaria</span> in large case-control studies of West African and East African populations, after correction for other known TNF polymorphisms and linked HLA alleles.	10369255	transfer/carrier protein; transporter	SLC22A1	6580	solute carrier family 22 member 1	SLC22A1	6580	C0024534	Malaria, Cerebral	null	C0024534	Malaria, Cerebral	Disease or Syndrome	D016779	Nervous System Diseases ; Parasitic Diseases	disease by infectious agent	disease	null	disease	0.0002747267842131	1999
